{
  "$schema": "https://json-schema.org/draft/2020-12/schema",
  "$id": "https://markoblogo.github.io/sitelen-emoji-truth/profiles/schema.json",
  "title": "sitelen-emoji profile",
  "type": "object",
  "additionalProperties": false,
  "required": ["name", "version", "generated_at", "sources", "aliases", "entries"],
  "properties": {
    "name": {
      "type": "string",
      "minLength": 1
    },
    "version": {
      "type": "string",
      "minLength": 1
    },
    "profile_type": {
      "type": "string",
      "minLength": 1
    },
    "description": {
      "type": "string",
      "minLength": 1
    },
    "word_count": {
      "type": "integer",
      "minimum": 0
    },
    "generated_at": {
      "type": "string",
      "minLength": 1
    },
    "sources": {
      "type": "array",
      "minItems": 1,
      "items": {
        "type": "object",
        "additionalProperties": true,
        "required": ["type", "url"],
        "properties": {
          "type": {
            "type": "string",
            "minLength": 1
          },
          "url": {
            "type": "string",
            "minLength": 1
          }
        }
      }
    },
    "aliases": {
      "type": "object",
      "additionalProperties": {
        "type": "string",
        "minLength": 1
      },
      "propertyNames": {
        "type": "string",
        "minLength": 1
      }
    },
    "entries": {
      "type": "object",
      "minProperties": 1,
      "additionalProperties": {
        "type": "string",
        "minLength": 1
      },
      "propertyNames": {
        "type": "string",
        "pattern": "^_?[A-Za-z][A-Za-z0-9_-]*$"
      }
    }
  }
}
