{
  "name": "sitelen-emoji extended",
  "version": "1.0.0",
  "profile_type": "extended",
  "description": "Upstream community mapping plus stable aliases and punctuation helpers. Experimental keys may change in future major versions.",
  "word_count": 443,
  "generated_at": "2026-06-08T20:50:46Z",
  "sources": [
    {
      "type": "upstream_json",
      "url": "https://raw.githubusercontent.com/devbali/desktop-sitelen-emoji/master/sitelenemoji.json"
    },
    {
      "type": "profile",
      "url": "profiles/default-stable.v1.json"
    }
  ],
  "aliases": {
    "ali": "ale"
  },
  "entries": {
    "a": "❗",
    "aja": "🇦🇲",
    "akanisan": "🇦🇫",
    "akesi": "🦎",
    "ala": "❌",
    "alan": "🇮🇪",
    "alasa": "🏹",
    "ale": "♾️",
    "alensina": "🇦🇷",
    "ali": "♾️",
    "alimala": "🇦🇪",
    "alupa": "🇦🇼",
    "amelika": "🌎",
    "amewikansamowa": "🇦🇸",
    "ankola": "🇦🇴",
    "anku": "🇰🇷",
    "anpa": "⬇️",
    "ansika": "🇦🇬",
    "antasika": "🇦🇶",
    "ante": "🔀",
    "antola": "🇦🇩",
    "anu": "☯️",
    "anwila": "🇦🇮",
    "apeja": "😢",
    "apika": "🌍",
    "asala": "🇪🇭",
    "asenson": "🇦🇨",
    "asepasan": "🇦🇿",
    "asija": "🌏",
    "awen": "⚓",
    "awisi": "🇭🇹",
    "e": "⏩",
    "ekato": "🇪🇨",
    "elena": "🇬🇷",
    "eliteja": "🇪🇷",
    "elopa": "🇪🇺",
    "en": "➕",
    "epanja": "🇪🇸",
    "epiku": "😎",
    "esalasi": "🇦🇹",
    "esi": "🇪🇪",
    "esuka": "🏴󠁥󠁳󠁰󠁶󠁿",
    "esun": "🛒",
    "ete": "🔃",
    "ewe": "🌋",
    "foja": "🇫🇴",
    "ijo": "🐚",
    "ike": "👎",
    "ilakija": "🇮🇶",
    "ilan": "🇮🇷",
    "ilo": "⚙️",
    "imi": "🇭🇲",
    "inli": "🏴󠁧󠁢󠁥󠁮󠁧󠁿",
    "insa": "⏺️",
    "intonesija": "🇮🇩",
    "isale": "🇮🇱",
    "isijopija": "🇪🇹",
    "isilan": "🇮🇸",
    "italija": "🇮🇹",
    "itomi": "😈",
    "jaki": "💩",
    "jakonko": "🇨🇬",
    "jamanija": "🇾🇪",
    "jami": "🤤",
    "jan": "👤",
    "jelo": "💛",
    "jesi": "🇯🇪",
    "jo": "👜",
    "juke": "🇬🇧",
    "kajan": "🇬🇾",
    "kala": "🐟",
    "kalalinuna": "🇬🇱",
    "kalama": "🔈",
    "kalibinetelan": "🇧🇶",
    "kama": "🚶",
    "kamalawala": "💣",
    "kamelun": "🇨🇲",
    "kan": "🔗",
    "kana": "🇬🇭",
    "kanalija": "🇮🇨",
    "kanata": "🇨🇦",
    "kanpija": "🇬🇲",
    "kanpusi": "🇰🇭",
    "kanse": "🇫🇷",
    "kapesi": "🟤",
    "kapon": "🇬🇦",
    "kapupesi": "🇨🇻",
    "kasatan": "🇰🇿",
    "kasi": "🌴",
    "katala": "🏴󠁥󠁳󠁣󠁴󠁿",
    "katelo": "🇬🇪",
    "katemala": "🇬🇹",
    "ken": "💪",
    "kenata": "🇬🇩",
    "kenedin": "🇻🇨",
    "kenja": "🇰🇪",
    "kensi": "🇬🇬",
    "kepeken": "🔧",
    "kesimen": "🇰🇾",
    "kijan": "🇬🇫",
    "kijetesantakalu": "🦝",
    "kikitan": "🇰🇬",
    "kili": "🍎",
    "kilima": "🇨🇽",
    "kilipasi": "🇰🇮",
    "kin": "❕",
    "kine": "🇬🇳",
    "kinejekatolija": "🇬🇶",
    "kinepisa": "🇬🇼",
    "kinla": "🏴󠁧󠁢󠁷󠁬󠁳󠁿",
    "kipeton": "🇨🇵",
    "kipisi": "✂️",
    "kiposi": "🇨🇾",
    "kita": "🇶🇦",
    "kiwen": "💎",
    "ko": "🍦",
    "koko": "🇨🇨",
    "kolonpa": "🇨🇴",
    "komo": "🇰🇲",
    "kon": "💨",
    "konko": "🇨🇩",
    "kosalika": "🇨🇷",
    "kosiwa": "🇨🇮",
    "kosopa": "🇽🇰",
    "kukialani": "🇨🇰",
    "kule": "🌈",
    "kuli": "🏴󠁩󠁲󠀱󠀶󠁿",
    "kulupu": "👥",
    "kulusu": "🇨🇼",
    "kuntu": "🤣",
    "kupa": "🇨🇺",
    "kusala": "🏴󠁩󠁮󠁧󠁪󠁿",
    "kute": "👂",
    "kuwasi": "🇰🇼",
    "la": "🔼",
    "lajenon": "🇷🇪",
    "laju": "🇱🇦",
    "lanka": "🇱🇰",
    "lanpan": "📥",
    "lape": "😴",
    "lapewija": "🇱🇷",
    "laso": "🔵",
    "lawa": "😶",
    "lawi": "🇱🇻",
    "leko": "🧱",
    "len": "👕",
    "lesoto": "🇱🇸",
    "lete": "❄️",
    "li": "▶️",
    "lijatuwa": "🇱🇹",
    "likujo": "🧺",
    "lili": "🐭",
    "linja": "〰️",
    "linluwi": "🌐",
    "lipija": "🇱🇾",
    "lipu": "📄",
    "lisensan": "🇱🇮",
    "loje": "🔴",
    "lokon": "🧿",
    "lomani": "🇷🇴",
    "lon": "📍",
    "losi": "🇷🇺",
    "lowasi": "🇭🇷",
    "lowenki": "🇸🇰",
    "lowensina": "🇸🇮",
    "luka": "✋",
    "lukin": "👀",
    "lunpan": "🇱🇧",
    "lupa": "🕳️",
    "lusepu": "🇱🇺",
    "luwanta": "🇷🇼",
    "ma": "🏝️",
    "majana": "🇲🇵",
    "maje": "🇲🇭",
    "majo": "🇾🇹",
    "majuna": "👵",
    "maketonija": "🇲🇰",
    "makonise": "🇫🇲",
    "malakasi": "🇲🇬",
    "malasija": "🇲🇾",
    "malawi": "🇲🇼",
    "mali": "🇲🇱",
    "malipe": "🇲🇦",
    "mama": "👪",
    "mani": "💰",
    "manin": "🇮🇲",
    "masini": "🇲🇶",
    "masu": "🇪🇬",
    "mata": "🇲🇹",
    "meli": "👧",
    "melome": "👩‍❤️‍👩",
    "mesiko": "🇲🇽",
    "mewika": "🇺🇸",
    "mewikalan": "🇺🇲",
    "mi": "👈",
    "mijama": "🇲🇲",
    "mije": "👨",
    "mijomi": "👨‍❤️‍👨",
    "misikeke": "💊",
    "moku": "🍽️",
    "moli": "💀",
    "monako": "🇲🇨",
    "monkolu": "🇲🇳",
    "monsale": "🇲🇸",
    "monsi": "⬅️",
    "monsuta": "👹",
    "mosanpi": "🇲🇿",
    "mosijo": "🇭🇺",
    "motowa": "🇲🇩",
    "mowisi": "🇲🇺",
    "mu": "😹",
    "mulapisu": "🍕",
    "mulitanija": "🇲🇷",
    "mun": "🌙",
    "musi": "😃",
    "mute": "👐",
    "namako": "🧂",
    "namipija": "🇳🇦",
    "nanpa": "#️⃣",
    "nasa": "🌀",
    "naselija": "🇳🇬",
    "nasin": "🛣️",
    "nawelo": "🇳🇷",
    "nena": "🗻",
    "nepa": "🇳🇵",
    "netelan": "🇳🇱",
    "ni": "👇",
    "nijon": "🇯🇵",
    "nikalawa": "🇳🇮",
    "nimi": "💬",
    "nise": "🇳🇪",
    "niwe": "🇳🇺",
    "noka": "🦵",
    "nopo": "🇳🇫",
    "nosiki": "🇳🇴",
    "nupekaletoni": "🇳🇨",
    "nusilan": "🇳🇿",
    "o": "👋",
    "oke": "👌",
    "okepuma": "🦖",
    "oko": "👁️",
    "olan": "🇦🇽",
    "olin": "💕",
    "omen": "🙄",
    "omun": "🇲🇴",
    "ona": "👆",
    "onkon": "🇭🇰",
    "ontula": "🇭🇳",
    "opekiton": "🇺🇿",
    "open": "🔓",
    "osejanija": "🌊",
    "oselija": "🇦🇺",
    "pa": "🤨",
    "pakala": "💥",
    "pake": "🚧",
    "pakisan": "🇵🇰",
    "palakawi": "🇵🇾",
    "palani": "🇧🇭",
    "palata": "🇮🇳",
    "pali": "✊",
    "palisa": "📏",
    "pan": "🍞",
    "pana": "📤",
    "panama": "🇵🇦",
    "panla": "🇧🇩",
    "papeto": "🇧🇧",
    "papuwanijukini": "🇵🇬",
    "pasila": "🇧🇷",
    "pata": "👯‍♀️",
    "pawama": "🇧🇸",
    "pela": "🇵🇼",
    "pelalusi": "🇧🇾",
    "pelis": "🇧🇿",
    "pelu": "🇵🇪",
    "pemuta": "🇧🇲",
    "penen": "🇧🇯",
    "penesuwela": "🇻🇪",
    "pesije": "🇧🇪",
    "peson": "🏴󠁦󠁲󠁢󠁲󠁥󠁿",
    "peta": "🟢",
    "peto": "😭",
    "pi": "⏹️",
    "pijenalan": "🇻🇮",
    "pijot": "🇮🇴",
    "piken": "🇵🇳",
    "pilin": "❤️",
    "pilipina": "🇵🇭",
    "pilisin": "🇵🇸",
    "pimeja": "⚫",
    "pini": "🏁",
    "pipi": "🐞",
    "pipo": "😒",
    "pisi": "🇫🇯",
    "pisinalan": "🇻🇬",
    "po": "🏴󠁣󠁮󠀵󠀴󠁿",
    "poka": "↔️",
    "pokan": "🇫🇰",
    "pokasi": "🇧🇬",
    "poki": "📦",
    "polinesi": "🇵🇫",
    "polinpin": "🎳",
    "polipa": "🇧🇴",
    "pomotolo": "📈",
    "pona": "👍",
    "posan": "🇧🇦",
    "posuka": "🇵🇱",
    "posuwana": "🇧🇼",
    "potuke": "🇵🇹",
    "powe": "🧞",
    "pu": "📖",
    "pukinapaso": "🇧🇫",
    "pukoson": "🇰🇵",
    "pune": "🇧🇳",
    "pupetoja": "🇧🇻",
    "puwetoliko": "🇵🇷",
    "sajoja": "🇬🇸",
    "sama": "⚖️",
    "samalino": "🇸🇲",
    "sameka": "🇯🇲",
    "samowa": "🇼🇸",
    "samu": "✍️",
    "sankinipi": "🇰🇳",
    "sanpija": "🇿🇲",
    "santapiken": "🇨🇫",
    "santume": "🇸🇹",
    "sapato": "🇸🇻",
    "sasali": "🇩🇿",
    "sasutan": "🇸🇸",
    "sate": "🇹🇩",
    "sateline": "🇸🇭",
    "sawasi": "🇸🇿",
    "sawusi": "🇸🇦",
    "sejuta": "🇪🇦",
    "seki": "🇨🇿",
    "seli": "🔥",
    "selo": "🔲",
    "sematan": "🇲🇫",
    "seme": "❓",
    "seneka": "🇸🇳",
    "senlusi": "🇱🇨",
    "sepapa": "🇸🇯",
    "sepatelemi": "🇧🇱",
    "sepemiko": "🇵🇲",
    "sese": "🇸🇨",
    "setapika": "🇿🇦",
    "sewi": "⬆️",
    "sijelalijon": "🇸🇱",
    "sijelo": "🏋️",
    "sike": "⭕",
    "sikomo": "🤩",
    "sile": "🇨🇱",
    "siliname": "🇸🇷",
    "simololosa": "🇹🇱",
    "sin": "🎁",
    "sina": "👉",
    "sinakola": "🇲🇪",
    "sinita": "🇹🇹",
    "sinkapo": "🇸🇬",
    "sinmaten": "🇸🇽",
    "sinpapuwe": "🇿🇼",
    "sinpin": "➡️",
    "sipata": "🇬🇮",
    "sipe": "🇦🇱",
    "sipeji": "🇲🇻",
    "sipusi": "🇩🇯",
    "sitelen": "🖼️",
    "siten": "🇹🇦",
    "soko": "🍄",
    "solomon": "🇸🇧",
    "somalija": "🇸🇴",
    "sona": "🧠",
    "sonko": "🇨🇳",
    "sopisi": "🇷🇸",
    "soto": "🤛",
    "soweli": "🐒",
    "su": "❔",
    "sukosi": "🏴󠁧󠁢󠁳󠁣󠁴󠁿",
    "suli": "🐘",
    "sulija": "🇸🇾",
    "sumi": "🇫🇮",
    "suno": "☀️",
    "supa": "🛏️",
    "sutan": "🇸🇩",
    "suwasi": "🇨🇭",
    "suwi": "🍭",
    "tan": "↩️",
    "tansanija": "🇹🇿",
    "tansi": "🇩🇰",
    "taso": "🤔",
    "tawa": "↪️",
    "tawan": "🇹🇼",
    "tawi": "🇹🇭",
    "te": "🤜",
    "tekeko": "🇹🇨",
    "tekokasija": "🇩🇬",
    "telo": "💧",
    "telota": "🇹🇫",
    "temenitan": "🇹🇲",
    "tenpo": "⏰",
    "tojikiton": "🇹🇯",
    "tokela": "🇹🇰",
    "toki": "🗣️",
    "toko": "🇹🇬",
    "tomini": "🇩🇲",
    "tominika": "🇩🇴",
    "tomo": "🏠",
    "tona": "🇹🇴",
    "tonsi": "♐",
    "tosi": "🇩🇪",
    "tu": "✌️",
    "tuki": "🇹🇷",
    "tukika": "🇧🇹",
    "tuli": "☘️",
    "tunisi": "🇹🇳",
    "tuwalu": "🇹🇻",
    "ukanta": "🇺🇬",
    "ukawina": "🇺🇦",
    "ulukawi": "🇺🇾",
    "uman": "🇴🇲",
    "unpa": "🍆",
    "upemoputuna": "🇼🇫",
    "upulunsi": "🇧🇮",
    "uta": "👄",
    "utala": "⚔️",
    "utun": "🇯🇴",
    "waleja": "ℹ️",
    "walo": "⚪",
    "wan": "🇬🇺",
    "wanuwatu": "🇻🇺",
    "wasikano": "🇻🇦",
    "waso": "🦅",
    "watalu": "🇬🇵",
    "wawa": "⚡",
    "wawajete": "🤡",
    "we": "🔒",
    "weka": "🛫",
    "wensa": "🇸🇪",
    "wi": "🙋",
    "wije": "🇻🇳",
    "wile": "💭",
    "yupekosi": "📉",
    "_punct_period": "➖️",
    "_punct_colon": "➗️"
  }
}
