{
  "name": "sitelen-emoji default-stable",
  "version": "0.1.0",
  "generated_at": "2026-01-22T19:12:59.742565+00:00",
  "sources": [
    {
      "type": "upstream_json",
      "url": "https://raw.githubusercontent.com/devbali/desktop-sitelen-emoji/master/sitelenemoji.json"
    }
  ],
  "aliases": {
    "ali": "ale"
  },
  "entries": {
    "a": "â—",
    "akesi": "ğŸ¦",
    "ala": "âŒ",
    "alasa": "ğŸ¹",
    "ale": "â™¾ï¸",
    "ali": "â™¾ï¸",
    "anpa": "â¬‡ï¸",
    "ante": "ğŸ”€",
    "anu": "â˜¯ï¸",
    "awen": "âš“",
    "e": "â©",
    "en": "â•",
    "esun": "ğŸ›’",
    "ijo": "ğŸš",
    "ike": "ğŸ‘",
    "ilo": "âš™ï¸",
    "insa": "âºï¸",
    "jaki": "ğŸ’©",
    "jan": "ğŸ‘¤",
    "jelo": "ğŸ’›",
    "jo": "ğŸ‘œ",
    "kala": "ğŸŸ",
    "kalama": "ğŸ”ˆ",
    "kama": "ğŸš¶",
    "kasi": "ğŸŒ´",
    "ken": "ğŸ’ª",
    "kepeken": "ğŸ”§",
    "kili": "ğŸ",
    "kiwen": "ğŸ’",
    "ko": "ğŸ¦",
    "kon": "ğŸ’¨",
    "kule": "ğŸŒˆ",
    "kulupu": "ğŸ‘¥",
    "kute": "ğŸ‘‚",
    "la": "ğŸ”¼",
    "lape": "ğŸ˜´",
    "laso": "ğŸ”µ",
    "lawa": "ğŸ˜¶",
    "len": "ğŸ‘•",
    "lete": "â„ï¸",
    "li": "â–¶ï¸",
    "lili": "ğŸ­",
    "linja": "ã€°ï¸",
    "lipu": "ğŸ“„",
    "loje": "ğŸ”´",
    "lon": "ğŸ“",
    "luka": "âœ‹",
    "lukin": "ğŸ‘€",
    "lupa": "ğŸ•³ï¸",
    "ma": "ğŸï¸",
    "mama": "ğŸ‘ª",
    "mani": "ğŸ’°",
    "meli": "ğŸ‘§",
    "mi": "ğŸ‘ˆ",
    "mije": "ğŸ‘¨",
    "moku": "ğŸ½ï¸",
    "moli": "ğŸ’€",
    "monsi": "â¬…ï¸",
    "mu": "ğŸ˜¹",
    "mun": "ğŸŒ™",
    "musi": "ğŸ˜ƒ",
    "mute": "ğŸ‘",
    "nanpa": "#ï¸âƒ£",
    "nasa": "ğŸŒ€",
    "nasin": "ğŸ›£ï¸",
    "nena": "ğŸ—»",
    "ni": "ğŸ‘‡",
    "nimi": "ğŸ’¬",
    "noka": "ğŸ¦µ",
    "o": "ğŸ‘‹",
    "olin": "ğŸ’•",
    "ona": "ğŸ‘†",
    "open": "ğŸ”“",
    "pakala": "ğŸ’¥",
    "pali": "âœŠ",
    "palisa": "ğŸ“",
    "pan": "ğŸ",
    "pana": "ğŸ“¤",
    "pi": "â¹ï¸",
    "pilin": "â¤ï¸",
    "pimeja": "âš«",
    "pini": "ğŸ",
    "pipi": "ğŸ",
    "poka": "â†”ï¸",
    "poki": "ğŸ“¦",
    "pona": "ğŸ‘",
    "pu": "ğŸ“–",
    "sama": "âš–ï¸",
    "seli": "ğŸ”¥",
    "selo": "ğŸ”²",
    "seme": "â“",
    "sewi": "â¬†ï¸",
    "sijelo": "ğŸ‹ï¸",
    "sike": "â­•",
    "sin": "ğŸ",
    "sina": "ğŸ‘‰",
    "sinpin": "â¡ï¸",
    "sitelen": "ğŸ–¼ï¸",
    "sona": "ğŸ§ ",
    "soweli": "ğŸ’",
    "suli": "ğŸ˜",
    "suno": "â˜€ï¸",
    "supa": "ğŸ›ï¸",
    "suwi": "ğŸ­",
    "tan": "â†©ï¸",
    "taso": "ğŸ¤”",
    "tawa": "â†ªï¸",
    "telo": "ğŸ’§",
    "tenpo": "â°",
    "toki": "ğŸ—£ï¸",
    "tomo": "ğŸ ",
    "tu": "âœŒï¸",
    "unpa": "ğŸ†",
    "uta": "ğŸ‘„",
    "utala": "âš”ï¸",
    "walo": "âšª",
    "wan": "ğŸ‡¬ğŸ‡º",
    "waso": "ğŸ¦…",
    "wawa": "âš¡",
    "weka": "ğŸ›«",
    "wile": "ğŸ’­",
    "_punct_period": "â–ï¸",
    "_punct_colon": "â—ï¸"
  }
}